{
  "schemaVersion": 1,
  "policyVersion": 1,
  "amountsFingerprint": "5eacea8726d04b968f561cb3a75af5a014e8225975d87f126f2ece063f968859",
  "enabledGoals": [
    "less-added-sugar",
    "balanced-pairing"
  ],
  "recipes": {
    "333": {
      "recipeFingerprint": "e5a3180531a0c7d8",
      "sourceLink": "https://github.com/Anduin2017/HowToCook/blob/master/dishes/vegetable_dish/西葫芦炒鸡蛋/西葫芦炒鸡蛋.md",
      "sourceFingerprint": "175f351179e37fc4",
      "reviewedAt": "2026-10-26",
      "ingredients": [
        "西葫芦",
        "鸡蛋",
        "西红柿",
        "食用盐",
        "食用油"
      ],
      "avoidIngredients": [
        "西葫芦",
        "鸡蛋",
        "西红柿",
        "食用盐",
        "食用油",
        "盐",
        "食盐",
        "油"
      ],
      "unresolvedIngredients": [],
      "ingredientEvidence": [
        {
          "block": 5,
          "item": 0,
          "text": "西葫芦"
        },
        {
          "block": 5,
          "item": 1,
          "text": "鸡蛋"
        },
        {
          "block": 5,
          "item": 2,
          "text": "西红柿（可选）"
        },
        {
          "block": 5,
          "item": 3,
          "text": "食用盐"
        },
        {
          "block": 5,
          "item": 4,
          "text": "食用油"
        }
      ],
      "foodGroups": [
        "vegetables",
        "protein"
      ],
      "assessments": {
        "less-added-sugar": {
          "status": "pass",
          "reason": "no-added-sugar",
          "evidence": [
            {
              "block": 5,
              "item": 0,
              "text": "西葫芦"
            },
            {
              "block": 5,
              "item": 1,
              "text": "鸡蛋"
            },
            {
              "block": 5,
              "item": 2,
              "text": "西红柿（可选）"
            },
            {
              "block": 5,
              "item": 3,
              "text": "食用盐"
            },
            {
              "block": 5,
              "item": 4,
              "text": "食用油"
            }
          ]
        },
        "balanced-pairing": {
          "status": "pass",
          "reason": "food-group-pairing",
          "evidence": [
            {
              "block": 5,
              "item": 0,
              "text": "西葫芦"
            },
            {
              "block": 5,
              "item": 1,
              "text": "鸡蛋"
            },
            {
              "block": 5,
              "item": 2,
              "text": "西红柿（可选）"
            },
            {
              "block": 5,
              "item": 3,
              "text": "食用盐"
            },
            {
              "block": 5,
              "item": 4,
              "text": "食用油"
            }
          ]
        },
        "weight-aware": {
          "status": "unknown",
          "reason": "unverified-portion-oil",
          "evidence": [
            {
              "block": 5,
              "item": 0,
              "text": "西葫芦"
            },
            {
              "block": 5,
              "item": 1,
              "text": "鸡蛋"
            },
            {
              "block": 5,
              "item": 2,
              "text": "西红柿（可选）"
            },
            {
              "block": 5,
              "item": 3,
              "text": "食用盐"
            },
            {
              "block": 5,
              "item": 4,
              "text": "食用油"
            }
          ]
        }
      }
    },
    "489": {
      "recipeFingerprint": "286db683266b8998",
      "sourceLink": "https://github.com/Anduin2017/HowToCook/blob/master/dishes/soup/罗宋汤.md",
      "sourceFingerprint": "dd5acaa67ca1fac7",
      "reviewedAt": "2026-10-26",
      "ingredients": [
        "蔬菜高汤",
        "牛肉高汤",
        "牛肉",
        "番茄",
        "番茄膏",
        "番茄罐头",
        "马铃薯",
        "洋葱",
        "胡萝卜",
        "欧芹",
        "包菜",
        "红肠",
        "橄榄油",
        "植物油",
        "盐",
        "黑胡椒",
        "水",
        "牛腩肉",
        "牛尾肉"
      ],
      "avoidIngredients": [
        "蔬菜高汤",
        "牛肉高汤",
        "牛肉",
        "番茄",
        "番茄膏",
        "番茄罐头",
        "马铃薯",
        "洋葱",
        "胡萝卜",
        "欧芹",
        "包菜",
        "红肠",
        "橄榄油",
        "植物油",
        "盐",
        "黑胡椒",
        "水",
        "牛腩肉",
        "牛尾肉",
        "猪肉",
        "土豆",
        "油",
        "食用盐",
        "食盐",
        "胡椒"
      ],
      "unresolvedIngredients": [
        "蔬菜高汤",
        "牛肉高汤",
        "番茄膏",
        "番茄罐头",
        "红肠"
      ],
      "ingredientEvidence": [
        {
          "block": 4,
          "item": 0,
          "text": "蔬菜高汤（欧芹、胡萝卜、洋葱三件套）"
        },
        {
          "block": 4,
          "item": 1,
          "text": "牛肉高汤（可用〇汤宝代替）"
        },
        {
          "block": 4,
          "item": 3,
          "text": "番茄（番茄膏、番茄罐头）"
        },
        {
          "block": 7,
          "item": 4,
          "text": "马铃薯 400 g"
        },
        {
          "block": 7,
          "item": 8,
          "text": "包菜 200 g"
        },
        {
          "block": 7,
          "item": 9,
          "text": "红肠 100 - 200 g"
        },
        {
          "block": 7,
          "item": 10,
          "text": "橄榄油 5 mL （橄榄油用于蔬菜的烹制，可以用植物油代替）"
        },
        {
          "block": 7,
          "item": 12,
          "text": "盐 18 g"
        },
        {
          "block": 7,
          "item": 13,
          "text": "黑胡椒 3 g"
        },
        {
          "block": 13,
          "item": 3,
          "text": "加水没过食材，中火烹制 1 小时"
        },
        {
          "block": 4,
          "item": 2,
          "text": "牛肉（可选牛腩肉或牛尾肉）"
        }
      ],
      "foodGroups": [
        "staple",
        "protein",
        "vegetables"
      ],
      "assessments": {
        "less-added-sugar": {
          "status": "unknown",
          "reason": "unverified-seasoning",
          "evidence": [
            {
              "block": 4,
              "item": 0,
              "text": "蔬菜高汤（欧芹、胡萝卜、洋葱三件套）"
            },
            {
              "block": 4,
              "item": 1,
              "text": "牛肉高汤（可用〇汤宝代替）"
            },
            {
              "block": 4,
              "item": 3,
              "text": "番茄（番茄膏、番茄罐头）"
            },
            {
              "block": 7,
              "item": 4,
              "text": "马铃薯 400 g"
            },
            {
              "block": 7,
              "item": 8,
              "text": "包菜 200 g"
            },
            {
              "block": 7,
              "item": 9,
              "text": "红肠 100 - 200 g"
            },
            {
              "block": 7,
              "item": 10,
              "text": "橄榄油 5 mL （橄榄油用于蔬菜的烹制，可以用植物油代替）"
            },
            {
              "block": 7,
              "item": 12,
              "text": "盐 18 g"
            },
            {
              "block": 7,
              "item": 13,
              "text": "黑胡椒 3 g"
            },
            {
              "block": 13,
              "item": 3,
              "text": "加水没过食材，中火烹制 1 小时"
            },
            {
              "block": 4,
              "item": 2,
              "text": "牛肉（可选牛腩肉或牛尾肉）"
            }
          ]
        },
        "balanced-pairing": {
          "status": "pass",
          "reason": "food-group-pairing",
          "evidence": [
            {
              "block": 4,
              "item": 0,
              "text": "蔬菜高汤（欧芹、胡萝卜、洋葱三件套）"
            },
            {
              "block": 4,
              "item": 1,
              "text": "牛肉高汤（可用〇汤宝代替）"
            },
            {
              "block": 4,
              "item": 3,
              "text": "番茄（番茄膏、番茄罐头）"
            },
            {
              "block": 7,
              "item": 4,
              "text": "马铃薯 400 g"
            },
            {
              "block": 7,
              "item": 8,
              "text": "包菜 200 g"
            },
            {
              "block": 7,
              "item": 9,
              "text": "红肠 100 - 200 g"
            },
            {
              "block": 7,
              "item": 10,
              "text": "橄榄油 5 mL （橄榄油用于蔬菜的烹制，可以用植物油代替）"
            },
            {
              "block": 7,
              "item": 12,
              "text": "盐 18 g"
            },
            {
              "block": 7,
              "item": 13,
              "text": "黑胡椒 3 g"
            },
            {
              "block": 13,
              "item": 3,
              "text": "加水没过食材，中火烹制 1 小时"
            },
            {
              "block": 4,
              "item": 2,
              "text": "牛肉（可选牛腩肉或牛尾肉）"
            }
          ]
        },
        "weight-aware": {
          "status": "unknown",
          "reason": "unverified-portion-oil",
          "evidence": [
            {
              "block": 4,
              "item": 0,
              "text": "蔬菜高汤（欧芹、胡萝卜、洋葱三件套）"
            },
            {
              "block": 4,
              "item": 1,
              "text": "牛肉高汤（可用〇汤宝代替）"
            },
            {
              "block": 4,
              "item": 3,
              "text": "番茄（番茄膏、番茄罐头）"
            },
            {
              "block": 7,
              "item": 4,
              "text": "马铃薯 400 g"
            },
            {
              "block": 7,
              "item": 8,
              "text": "包菜 200 g"
            },
            {
              "block": 7,
              "item": 9,
              "text": "红肠 100 - 200 g"
            },
            {
              "block": 7,
              "item": 10,
              "text": "橄榄油 5 mL （橄榄油用于蔬菜的烹制，可以用植物油代替）"
            },
            {
              "block": 7,
              "item": 12,
              "text": "盐 18 g"
            },
            {
              "block": 7,
              "item": 13,
              "text": "黑胡椒 3 g"
            },
            {
              "block": 13,
              "item": 3,
              "text": "加水没过食材，中火烹制 1 小时"
            },
            {
              "block": 4,